[
  {
    "SchemaVersion": "1.0.0",
    "DataVersion": "2025-11-28",
    "Name": "Acrobatics",
    "ID": "PSK_Acrobatics",
    "AbilityID": "ABL_Dexterity",
    "Description": "Your Dexterity (Acrobatics) check covers your attempt to stay on your feet in a tricky situation, such as when you're trying to run across a sheet of ice, balance on a tightrope, or stay upright on a rocking ship's deck.",
    "TypeTags": [
      "Skill.Physical"
    ]
  },
  {
    "SchemaVersion": "1.0.0",
    "DataVersion": "2025-11-28",
    "Name": "Animal Handling",
    "ID": "PSK_AnimalHandling",
    "AbilityID": "ABL_Wisdom",
    "Description": "When there is any question whether you can calm down a domesticated animal, keep a mount from getting spooked, or intuit an animal's intentions, the DM might call for a Wisdom (Animal Handling) check.",
    "TypeTags": [
      "Skill.Physical"
    ]
  },
  {
    "SchemaVersion": "1.0.0",
    "DataVersion": "2025-11-28",
    "Name": "Arcana",
    "ID": "PSK_Arcana",
    "AbilityID": "ABL_Intelligence",
    "Description": "Your Intelligence (Arcana) check measures your ability to recall lore about spells, magic items, eldritch symbols, magical traditions, the planes of existence, and the inhabitants of those planes.",
    "TypeTags": [
      "Skill.Knowledge"
    ]
  },
  {
    "SchemaVersion": "1.0.0",
    "DataVersion": "2025-11-28",
    "Name": "Athletics",
    "ID": "PSK_Athletics",
    "AbilityID": "ABL_Strength",
    "Description": "Your Strength (Athletics) check covers difficult situations you encounter while climbing, jumping, or swimming.",
    "TypeTags": [
      "Skill.Physical"
    ]
  },
  {
    "SchemaVersion": "1.0.0",
    "DataVersion": "2025-11-28",
    "Name": "Deception",
    "ID": "PSK_Deception",
    "AbilityID": "ABL_Charisma",
    "Description": "Your Charisma (Deception) check determines whether you can convincingly hide the truth, either verbally or through your actions.",
    "TypeTags": [
      "Skill.Social"
    ]
  },
  {
    "SchemaVersion": "1.0.0",
    "DataVersion": "2025-11-28",
    "Name": "History",
    "ID": "PSK_History",
    "AbilityID": "ABL_Intelligence",
    "Description": "Your Intelligence (History) check measures your ability to recall lore about historical events, legendary people, ancient kingdoms, past disputes, recent wars, and lost civilizations.",
    "TypeTags": [
      "Skill.Knowledge"
    ]
  },
  {
    "SchemaVersion": "1.0.0",
    "DataVersion": "2025-11-28",
    "Name": "Insight",
    "ID": "PSK_Insight",
    "AbilityID": "ABL_Wisdom",
    "Description": "Your Wisdom (Insight) check decides whether you can determine the true intentions of a creature, such as when searching out a lie or predicting someone's next move.",
    "TypeTags": [
      "Skill.Social"
    ]
  },
  {
    "SchemaVersion": "1.0.0",
    "DataVersion": "2025-11-28",
    "Name": "Intimidation",
    "ID": "PSK_Intimidation",
    "AbilityID": "ABL_Charisma",
    "Description": "When you attempt to influence someone through overt threats, hostile actions, and physical violence, the DM might ask you to make a Charisma (Intimidation) check.",
    "TypeTags": [
      "Skill.Social"
    ]
  },
  {
    "SchemaVersion": "1.0.0",
    "DataVersion": "2025-11-28",
    "Name": "Investigation",
    "ID": "PSK_Investigation",
    "AbilityID": "ABL_Intelligence",
    "Description": "When you look around for clues and make deductions based on those clues, you make an Intelligence (Investigation) check.",
    "TypeTags": [
      "Skill.Knowledge"
    ]
  },
  {
    "SchemaVersion": "1.0.0",
    "DataVersion": "2025-11-28",
    "Name": "Medicine",
    "ID": "PSK_Medicine",
    "AbilityID": "ABL_Wisdom",
    "Description": "A Wisdom (Medicine) check lets you try to stabilize a dying companion or diagnose an illness.",
    "TypeTags": [
      "Skill.Knowledge"
    ]
  },
  {
    "SchemaVersion": "1.0.0",
    "DataVersion": "2025-11-28",
    "Name": "Nature",
    "ID": "PSK_Nature",
    "AbilityID": "ABL_Intelligence",
    "Description": "Your Intelligence (Nature) check measures your ability to recall lore about terrain, plants and animals, the weather, and natural cycles.",
    "TypeTags": [
      "Skill.Knowledge"
    ]
  },
  {
    "SchemaVersion": "1.0.0",
    "DataVersion": "2025-11-28",
    "Name": "Perception",
    "ID": "PSK_Perception",
    "AbilityID": "ABL_Wisdom",
    "Description": "Your Wisdom (Perception) check lets you spot, hear, or otherwise detect the presence of something. It measures your general awareness of your surroundings and the keenness of your senses.",
    "TypeTags": [
      "Skill.Physical"
    ]
  },
  {
    "SchemaVersion": "1.0.0",
    "DataVersion": "2025-11-28",
    "Name": "Performance",
    "ID": "PSK_Performance",
    "AbilityID": "ABL_Charisma",
    "Description": "Your Charisma (Performance) check determines how well you can delight an audience with music, dance, acting, storytelling, or some other form of entertainment.",
    "TypeTags": [
      "Skill.Social"
    ]
  },
  {
    "SchemaVersion": "1.0.0",
    "DataVersion": "2025-11-28",
    "Name": "Persuasion",
    "ID": "PSK_Persuasion",
    "AbilityID": "ABL_Charisma",
    "Description": "When you attempt to influence someone or a group of people with tact, social graces, or good nature, the DM might ask you to make a Charisma (Persuasion) check.",
    "TypeTags": [
      "Skill.Social"
    ]
  },
  {
    "SchemaVersion": "1.0.0",
    "DataVersion": "2025-11-28",
    "Name": "Religion",
    "ID": "PSK_Religion",
    "AbilityID": "ABL_Intelligence",
    "Description": "Your Intelligence (Religion) check measures your ability to recall lore about deities, rites and prayers, religious hierarchies, holy symbols, and the practices of secret cults.",
    "TypeTags": [
      "Skill.Knowledge"
    ]
  },
  {
    "SchemaVersion": "1.0.0",
    "DataVersion": "2025-11-28",
    "Name": "Sleight of Hand",
    "ID": "PSK_SleightOfHand",
    "AbilityID": "ABL_Dexterity",
    "Description": "Whenever you attempt an act of legerdemain or manual trickery, such as planting something on someone else or concealing an object on your person, make a Dexterity (Sleight of Hand) check.",
    "TypeTags": [
      "Skill.Physical"
    ]
  },
  {
    "SchemaVersion": "1.0.0",
    "DataVersion": "2025-11-28",
    "Name": "Stealth",
    "ID": "PSK_Stealth",
    "AbilityID": "ABL_Dexterity",
    "Description": "Make a Dexterity (Stealth) check when you attempt to conceal yourself from enemies, slip away without being noticed, or sneak up on someone without being seen or heard.",
    "TypeTags": [
      "Skill.Physical"
    ]
  },
  {
    "SchemaVersion": "1.0.0",
    "DataVersion": "2025-11-28",
    "Name": "Survival",
    "ID": "PSK_Survival",
    "AbilityID": "ABL_Wisdom",
    "Description": "The DM might ask you to make a Wisdom (Survival) check to follow tracks, hunt wild game, guide your group through frozen wastelands, identify signs that owlbears live nearby, predict the weather, or avoid quicksand and other natural hazards.",
    "TypeTags": [
      "Skill.Physical"
    ]
  }
]